= 遇见的问题及解决办法
:toc: left
:toc-title: Table of Contents
:toclevels: 4
:sectnums:
:sectnumlevels: 3
:sectanchors:
:sectlinks:
:partnums:

. VMware 中CentOS7安装后无Ip地址
 .. 虚拟机网络修改为**NAT模式**
 .. 修改 `/etc/sysconfig/neywork-scrpits/ifcfg-en33` 中 ONBOOT属性值为true
 .. 重启服务：`service network restart`
 .. ifconfig查看，已经恢复正常
. 使用 exec 22<> /etc/tcp/www.baidu.com/80命令时提示目录不存在
 .. 查看发现不存在/etc/tcp目录
 .. 目录修改为``+**/dev/tcp**+``
. cd /proc/$$/fd
. lsof -p $$

== 知识点

=== exec连接百度

. exec 8<> /dev/tcp/www.baidu.com/80
 ** 打开一个socket连接，文件描述符为8
 ** 查看开启的文件描述符：`cd /proc/$$/fd   ll`
 ** 关闭文件描述符：
  *** exec 8<& -
 ** 命令由内核完成
. echo -e "GET / HTTP/1.0\n" 1>& 8
 ** ``"GET / HTTP/1.0\n"``为请求头，必须按照格式书写
. cat 0<& 8

=== Tcp

. 3次握手：同时需要保证通信双方的 `I/O` 都有效
. 4次分手
 .. 请求

*抓包验证* 使用 `tcpdump`，可以监控网卡的数据包并捕获

* -nn，不显示 http等信息
* -i ： 网卡名称
* port：端口

. tcpdump -nn -i ens33 port 80

[source,text]
----
20:22:01.629499 IP 192.168.45.129.50126 > 14.215.177.38.80: Flags [S], seq 2457710486, win 29200, options [mss 1460,sackOK,TS val 6620214 ecr 0,nop,wscale 7], length 0
20:22:01.677146 IP 14.215.177.38.80 > 192.168.45.129.50126: Flags [S.], seq 798575534, ack 2457710487, win 64240, options [mss 1460], length 0
20:22:01.677516 IP 192.168.45.129.50126 > 14.215.177.38.80: Flags [.], ack 1, win 29200, length 0
20:22:01.677922 IP 192.168.45.129.50126 > 14.215.177.38.80: Flags [P.], seq 1:78, ack 1, win 29200, length 77: HTTP: GET / HTTP/1.1
20:22:01.678807 IP 14.215.177.38.80 > 192.168.45.129.50126: Flags [.], ack 78, win 64240, length 0
20:22:01.727655 IP 14.215.177.38.80 > 192.168.45.129.50126: Flags [P.], seq 1:2782, ack 78, win 64240, length 2781: HTTP: HTTP/1.1 200 OK
20:22:01.727859 IP 192.168.45.129.50126 > 14.215.177.38.80: Flags [.], ack 2782, win 33580, length 0
20:22:01.728486 IP 192.168.45.129.50126 > 14.215.177.38.80: Flags [F.], seq 78, ack 2782, win 33580, length 0
20:22:01.729258 IP 14.215.177.38.80 > 192.168.45.129.50126: Flags [.], ack 79, win 64239, length 0
20:22:01.772705 IP 14.215.177.38.80 > 192.168.45.129.50126: Flags [FP.], seq 2782, ack 79, win 64239, length 0
20:22:01.772966 IP 192.168.45.129.50126 > 14.215.177.38.80: Flags [.], ack 2783, win 33580, length 0
----

=== Socket

. 四元组
. 源主机IP+端口，目标主机IP+端口
. 因此，同一台电脑上的同一个端口可以有多个连接，只要对端IP+端口与之前的唯一
. 只要能唯一识别就行
